tech_id,dataset,sector_name,subsector,item_no,tech_name,tech_description
newgrowth::9::가::1),newgrowth,융복합소재,가. 고기능섬유,1),탄소섬유복합재의 가공장비 및 검사장비 설계ㆍ제조기술,"탄소섬유복합재 부품가공을 위한 복합 가공장비[관련되는 공구, 부품 고정을 위한 유연지그, 공정 모니터링 센서모듈 및 컴퓨터 수치제어기(CNC, Computerized Numerical Controller) 등을 포함한다] 설계ㆍ제조기술 및 탄소섬유복합재 가공 품질 검사를 위한 검사장비 설계ㆍ제조기술"
newgrowth::9::가::2),newgrowth,융복합소재,가. 고기능섬유,2),극한성능 섬유 제조 기술,"고탄성ㆍ고강도 탄소섬유 또는 섬유용 CNT(Carbon Nano Tube, 탄소나노튜브)의 제조 기술과 고탄성ㆍ고강도ㆍ고내열성(250℃ 이상)ㆍ고내한성(-153℃∼-273℃) 아라미드(Aramid)ㆍ초고분자량폴리에틸렌(UHMWPE)ㆍ액정섬유의 제조 기술 및 이들의 복합화 설계를 통한 초경량ㆍ고탄성ㆍ고강도ㆍ고내열(한)성 섬유복합체 제조 기술"
newgrowth::9::가::3),newgrowth,융복합소재,가. 고기능섬유,3),섬유기반 전기전자 소재ㆍ부품 및 제품 제조 기술,"전기 또는 광 신호의 생산, 저장 또는 전달이 가능한 전도성 섬유를 가공ㆍ변형하여 트랜지스터, 저항, 콘덴서, 안테나 등의 전자회로 소자를 직물 형태로 구현하는 기술"
newgrowth::9::가::4),newgrowth,융복합소재,가. 고기능섬유,4),의료용 섬유 제조 기술,"생체적합성(생체재료가 생체조직이나 체액ㆍ혈액 등과 접촉시 거부반응이 나타나지 않는 특성)과 생체기능성(생체재료가 체내에서 존재하는 동안 목표한 기능을 완전히 수행 가능한 특성)을 갖춘 의료용 섬유 제조기술로서, 약물전달용 나노섬유 소재, 바이러스ㆍ세균 감응섬유구조체, 혈액의 투석ㆍ정화용 섬유구조체, 손상조직을 대체 가능한 섬유구조체 또는 꼬이지 않고 계속되는 수축ㆍ팽창에 견딜 수 있는 인공혈관 섬유구조체의 제조 기술"
newgrowth::9::가::5),newgrowth,융복합소재,가. 고기능섬유,5),친환경섬유 제조 기술,"환경친화적 섬유 원료를 사용한 섬유 제조기술로서 생분해성 섬유고분자 제조 및 분해성 제어 기술, 열가소성 셀룰로오스 섬유 제조 기술, 바이오매스 나노섬유 제조 기술"
newgrowth::9::가::6),newgrowth,융복합소재,가. 고기능섬유,6),PTFE(PolyTetraFluoro Ethylene) 멤브레인 기반 고성능 복합필터 제조기술,공기 중의 0.3um 크기의 입자 99.97% 이상을 균일하게 포집할 수 있는 PTFE 멤브레인 기반의 고성능 복합필터 핵심 소재ㆍ부품 관련 제조ㆍ가공 기술
newgrowth::9::가::7),newgrowth,융복합소재,가. 고기능섬유,7),특수계면활성제 제조 기술,"전자부품 제조 공정용으로 사용되는 저표면에너지(24∼27 mN/m, 0.1% solution/PGMEA), 극미량의 금속함유량(100ppb 이하) 특성을 지닌 불소계 계면활성제 및 도료 및 포소화제의 기능향상을 위한 첨가제 등으로 사용되는 저표면에너지(15∼18 mN/m, 0.1% 수용액), 극미량의 PFOA 함유량(1ppm 미만) 특성을 지닌 불소계 계면활성제 제조 기술"
newgrowth::9::가::8),newgrowth,융복합소재,가. 고기능섬유,8),극세 장섬유 부직포 및 복합필터 제조기술,유해물질을 여과ㆍ분리ㆍ차단하는 1㎛이하 극세 장섬유 부직포 제조기술과 HEPA(High Efficiency Particulate Air)급 이상의 고성능 정밀여과 복합필터 제조 기술
newgrowth::9::나::1),newgrowth,융복합소재,나. 초경량 금속,1),고강도 마그네슘 부품의 온간성형기술,미세조직 구성인자의 제어와 성형기법의 개선을 통해 저온(150℃ 이하)에서 성형 가능한 고품위ㆍ고강도 Mg(마그네슘) 부품 제조 기술
newgrowth::9::나::2),newgrowth,융복합소재,나. 초경량 금속,2),차세대 조명용 고효율 경량 방열부품 생산기반기술,"알루미늄 등 경량소재를 이용하여 주조, 성형 및 표면처리를 통해 방열 부품을 제조함으로써 고열전도도, 열확산능, 친환경 특성 등의 기능을 갖게 하는 기술"
newgrowth::9::다::,newgrowth,융복합소재,다. 하이퍼 플라스틱,,인성특성이 향상된 고강성 하이퍼플라스틱(High Performance Plastics) 복합체 제조 및 가공 기술,"고강성 하이퍼플라스틱의 인성특성을 개선하여 고충격성(60KJ/m² 이상), 내화학성(온도 23℃의 염화칼슘 5% 용액에 600시간 담근 후 인장강도 유지율 90% 이상), 내마모성(50rpm, 150N, 측정거리 3Km 조건으로 내마모 시험 후 마모량 1.0mm3/KgfㆍKm 이하) 중 하나 이상의 특성을 지닌 고강성ㆍ고인성 하이퍼플라스틱 복합체 제조 및 가공기술"
newgrowth::9::라::1),newgrowth,융복합소재,라. 구리합금,1),고강도 구리합금 설계ㆍ제조기술,인장강도 900Mpa 이상의 고강도 특성을 갖춘 주석함유 구리합금(Cu-Ni-Sn계) 설계ㆍ제조 기술
newgrowth::9::라::2),newgrowth,융복합소재,라. 구리합금,2),구리 및 구리합금 박판 제조기술,"자동차, 전기ㆍ전자 분야의 고성능ㆍ소형화에 적용 가능한 두께 0.1mm 이하의 구리 및 구리합금 박판 제조 기술"
newgrowth::9::마::1),newgrowth,융복합소재,마. 특수강,1),고청정 스테인레스계 무계목강관ㆍ봉강 제조기술,망간 함유량 0.8% 이하 및 황 함유량 0.005%이하로 제어된 고청정 스테인리스계 합금을 활용하여 용접이음매를 갖지 않는 강관 및 봉 형태의 철강재를 제조하는 기술
newgrowth::9::마::2),newgrowth,융복합소재,마. 특수강,2),고기능성 H형강 제품 제조기술,"고강도(420Mpa급 이상), 고인성(-40℃이하에서 충격값 50 Joule 이상) 특성을 갖는 고기능성 H형강 제품 제조기술"
newgrowth::9::마::3),newgrowth,융복합소재,마. 특수강,3),장수명 프리미엄급 금형소재 제조기술,"기존 교체주기 5만회의 금형대비 30%이상 수명이 향상된 합금설계, 고청정 특수강 제조 및 소성가공 기술"
newgrowth::9::바::1),newgrowth,융복합소재,바. 기능성 탄성ㆍ접착소재,1),고기능 불소계 실리콘 제조ㆍ가공 기술,"내열성(온도 175℃에서 22시간동안 영구압축줄음율 30%이내), 내화학성(150℃, 240시간 내유체적변화율 10%이하) 및 저온성(-66℃이하에서 기밀력 1800psi이상)의 특성을 지닌 불소계 실리콘 고무 합성 및 분자량 제어기술"
newgrowth::9::바::2),newgrowth,융복합소재,바. 기능성 탄성ㆍ접착소재,2),고기능 불소계 고무 제조ㆍ가공 기술,"2원계 이상의 공중합체로서 불소함량이 50% 이상이며 내한성(어는점 －15℃ 이하), 내열성(200℃ 이상) 및 내화학성(온도 25℃ Fuel-C에서 체적변화율 4% 이내)을 갖춘 불소계 고무 제조ㆍ가공기술"
newgrowth::9::바::3),newgrowth,융복합소재,바. 기능성 탄성ㆍ접착소재,3),고기능 부타디엔 고무 제조ㆍ가공 기술,"고상 및 액상 기능성(Cis content 90% 이상, 무니점도(ML1+4, 100℃) 40 이상) 부타디엔류 고무 제조 기술과 고내마모성(내마모도 60㎣ 이하, 구름저항 5.5 이하) 부타디엔 고무 제조 기술"
newgrowth::9::바::4),newgrowth,융복합소재,바. 기능성 탄성ㆍ접착소재,4),고기능 비극성계 접착소재 제조기술,Haze 1% 이하의 광학특성과 연속사용온도 100℃의 열안정성을 갖는 실리콘계 점착ㆍ접착 소재 및 300℃ 이상의 고온가공성형이 가능한 아크릴레이트 함량 5∼35% 또는 관능기의 함량 1.2∼8%의 에틸렌계 점착ㆍ접착 소재 제조 기술
newgrowth::9::바::5),newgrowth,융복합소재,바. 기능성 탄성ㆍ접착소재,5),고기능 에폭시 수지 접착소재 제조 기술,"에폭시 수지를 주성분으로 하여 경량 수송기기 부품의 구조접착에 사용되는 전단강도 25MPa 이상, 저온 충격강도 20N/mm 이상,  T-박리강도 250N/25mm 이상의 기계적 성능을 갖는 접착소재 제조기술과 전자부품의 접착에 사용되는 WVTR( Water Vapor Transmission Rate) 0g/㎡ㆍ24h 이하 및 20kV/mm 이상의 전기절연성을 갖는 비할로겐형 접착소재 제조기술"
newgrowth::9::사::1),newgrowth,융복합소재,사. 희소금속ㆍ소재,1),타이타늄 소재 제조기술과 금속재료 부품화 기술,"사염화타이타늄(TiCl4), 스폰지, 잉곳, 루타일 및 아나타제 이산화타이타늄(TiO2) 등의 소재 개발ㆍ제조기술과 합금설계, 압연, 주조, 단조, 용접 등의 금속재료 부품화 기술"
newgrowth::9::사::2),newgrowth,융복합소재,사. 희소금속ㆍ소재,2),고순도 몰리브덴 금속ㆍ탄화물 분말 및 금속괴 제조 기술,"순도 99.5% 이상의 몰리브덴 금속분말, 순도 99% 이상의 몰리브덴 탄화물 분말 및 순도 99.95% 이상의 몰리브덴 금속괴 제조 기술"
newgrowth::9::사::3),newgrowth,융복합소재,사. 희소금속ㆍ소재,3),중희토 저감 고기능 영구자석 생산 기술,결정립도 5μm이하 소결체 제조 및 결정립 주변 나노단위 두께의 중희토 확산층 형성 등을 통해 기존 자석 대비 중희토 함유량을 50% 이상 절감하여 고기능 영구자석을 생산하는 기술
newgrowth::9::사::4),newgrowth,융복합소재,사. 희소금속ㆍ소재,4),차세대 배기가스 규제 대응을 위한 핵심소재 생산 기술,"포집된 이산화탄소를 활용하여 운송·발전·산업용 기관을 운전할 때 배출되는 배기가스내 질소산화물, 황산화물 등 배기배출물을 저감시키기 위해 필요한 핵심소재 제조기술"
newgrowth::9::사::5),newgrowth,융복합소재,사. 희소금속ㆍ핵심소재,5),고융점 금속 기반 4N급 염화물 또는 불화물 전환 기술,"저순도 고융점 금속을 고밀도 열원을 통해 4N급(99.99%) 이상의 초고순도 금속으로 정제한 후, 염소 또는 불소계 반응원을 이용해 염화물 또는 불화물로 전환하여 반도체용 전구체 원료 소재를 제조하는 기술"
